Lorem ipsum dolor sit amet, consectetur adipiscing elit. Suspendisse nec dui ut velit tincidunt auctor.;Sim
Duis id diam gravida, sollicitudin tellus in, blandit felis. Fusce elementum congue ante ut finibus.;Sim
Nunc luctus mauris eu nisl mattis ornare a ac tellus. Nunc nec dignissim odio, vitae tristique purus.;Sim
Nullam pharetra pretium Lorem blandit. Morbi aliquam tortor sit amet urna dapibus, a viverra nibh efficitur.;Sim
Phasellus lobortis odio in mi pulvinar molestie.;Sim
Vestibulum ante ipsum primis in Lorem faucibus orci luctus et ultrices posuere cubilia curae;;Sim
Morbi nec sagittis turpis, non fermentum turpis. Nulla cursus felis eget justo placerat, a congue urna accumsan./nnova frase teste;Sim
nova frase no console;Sim
outra frase no console;Sim
Aliquam erat volutpat. Pellentesque ut porttitor est.;N達o
02- Aliquam erat volutpat. Pellentesque ut porttitor est.;N達o
02- Aliquam erat volutpat. Pellentesque ut porttitor est.;N達o
02- Aliquam erat volutpat. Pellentesque ut porttitor est.;N達o
